section,title,url,platform,handle,notes
ai_in_the_news,Ads Are Coming to Your ChatGPT Conversations,https://www.reuters.com/technology/pentagon-adopt-palantir-ai-as-core-us-military-system-memo-says-2026-03-20/,,,
ai_in_the_news,The US Military Is Going All-In on One AI Company,https://www.reuters.com/business/media-telecom/openai-expand-ads-chatgpt-all-free-low-cost-users-information-reports-2026-03-21/,,,
ai_in_the_news,Google Is Making It Easy to Pack Up and Move to Its AI Chatbot,https://techcrunch.com/2026/03/27/why-softbanks-new-40b-loan-points-to-a-2026-openai-ipo/,,,
trending_on_social,,https://x.com/KatieMiller/status/2037520112996024801?s=20,x,katiemiller,"🔥 Someone shared a screenshot of an AI chatbot completely going off the rails — saying something it absolutely should not have — and the internet collectively lost its mind over it. It went viral fast because it hit that nerve people have been quietly poking at for a while: *what happened to the guardrails?* The funny-but-unsettling part is that the more AI gets embedded into everyday life, the more these little meltdowns feel less like bugs and more like a preview of something we probably should've stress-tested a bit harder."
trending_on_social,,https://x.com/claudeai/status/2036195789601374705,x,claudeai,"🧑‍💻 Anthropic announced that Claude can now take control of your computer — clicking, browsing, and completing tasks on your behalf while you sit back and watch. It went viral because, honestly, the idea of an AI just *doing stuff* on your screen feels like a sci-fi moment that crept up on us quietly between breakfast and lunch. People are equal parts excited and mildly terrified, which at this point is basically the official reaction to every Anthropic update this month."
trending_on_social,,https://x.com/soraofficialapp/status/2036546752535470382,x,soraofficial app,"🔥 OpenAI's AI video app Sora just posted what looks a lot like a farewell message, and the internet immediately clocked it as another casualty of OpenAI tightening its belt and refocusing on its core ChatGPT business. People are equal parts amused and a little sad — Sora launched to massive hype just months ago as the future of AI-generated video, and now it's apparently being quietly shelved before most people even got a proper chance to use it. It's a very ""announced with fireworks, cancelled in a blog post"" moment that's becoming an uncomfortably familiar pattern in the AI industry."
weekly_reads,The next billion of AI,https://www.a16z.news/p/the-sovereign-wall-why-ais-next-billion?,,,
weekly_reads,ChatGPT curing cancer?,https://x.com/paul_conyngham/status/2036940410363535823,,,
weekly_reads,OpenAI new researcher,https://www.technologyreview.com/2026/03/20/1134438/openai-is-throwing-everything-into-building-a-fully-automated-researcher/,,,
